{
  "$schema": "http://json-schema.org/draft-07/schema#",
  "$id": "https://stock.local/schemas/a_long_000666_sw_membership_supplement_execution_summary/1.0.0/schema.json",
  "title": "A-long 000666 SW Membership Supplement Execution Summary",
  "description": "Tracked no-secret summary for the reviewed A-long 000666.SZ SW membership supplement probe. Raw rows must stay gitignored. This summary never authorizes signal search, audit rerun, production, ship-gate evidence, full-size use, or broker automation.",
  "type": "object",
  "additionalProperties": false,
  "required": [
    "schema_name",
    "schema_version",
    "generated_at",
    "artifact_id",
    "packet_ref",
    "scope",
    "execution",
    "target",
    "endpoint_results",
    "decision",
    "prohibited_claims",
    "limitations"
  ],
  "properties": {
    "schema_name": {"const": "a_long_000666_sw_membership_supplement_execution_summary"},
    "schema_version": {"const": "1.0.0"},
    "generated_at": {"type": "string", "format": "date-time"},
    "artifact_id": {"const": "a_long_000666_sw_membership_supplement_execution_summary_20260604"},
    "packet_ref": {"const": "docs/a_long_000666_sw_membership_supplement_packet_20260604.json"},
    "scope": {"$ref": "#/$defs/scope"},
    "execution": {"$ref": "#/$defs/execution"},
    "target": {"$ref": "#/$defs/target"},
    "endpoint_results": {"type": "array", "items": {"$ref": "#/$defs/endpointResult"}, "maxItems": 4},
    "decision": {"$ref": "#/$defs/decision"},
    "prohibited_claims": {"$ref": "#/$defs/prohibitedClaims"},
    "limitations": {"$ref": "#/$defs/stringList"}
  },
  "$defs": {
    "nonEmptyString": {"type": "string", "minLength": 1},
    "stringList": {"type": "array", "items": {"$ref": "#/$defs/nonEmptyString"}, "minItems": 1},
    "scope": {
      "type": "object",
      "additionalProperties": false,
      "required": [
        "phase",
        "purpose",
        "lane_id",
        "market",
        "research_only",
        "single_symbol_supplement_only",
        "target_symbol",
        "provider_family",
        "provider_call_executed",
        "tushare_call_executed",
        "data_fetch_executed",
        "raw_payload_written_to_gitignored_path",
        "tracked_summary_contains_raw_rows",
        "tracked_summary_contains_secret",
        "audit_rerun_executed",
        "signal_search_executed",
        "alpha_backtest_executed",
        "datahub_allowed",
        "production_use_allowed",
        "ship_gate_claim_allowed",
        "full_size_manual_use_allowed",
        "broker_or_order_automation_allowed",
        "manual_order_only"
      ],
      "properties": {
        "phase": {"const": "7a_alpha_validation"},
        "purpose": {"const": "a_long_000666_sw_membership_supplement_execution"},
        "lane_id": {"const": "a_long"},
        "market": {"const": "A-share"},
        "research_only": {"const": true},
        "single_symbol_supplement_only": {"const": true},
        "target_symbol": {"const": "000666.SZ"},
        "provider_family": {"const": "tushare_existing_account"},
        "provider_call_executed": {"type": "boolean"},
        "tushare_call_executed": {"type": "boolean"},
        "data_fetch_executed": {"type": "boolean"},
        "raw_payload_written_to_gitignored_path": {"type": "boolean"},
        "tracked_summary_contains_raw_rows": {"const": false},
        "tracked_summary_contains_secret": {"const": false},
        "audit_rerun_executed": {"const": false},
        "signal_search_executed": {"const": false},
        "alpha_backtest_executed": {"const": false},
        "datahub_allowed": {"const": false},
        "production_use_allowed": {"const": false},
        "ship_gate_claim_allowed": {"const": false},
        "full_size_manual_use_allowed": {"const": false},
        "broker_or_order_automation_allowed": {"const": false},
        "manual_order_only": {"const": true}
      }
    },
    "execution": {
      "type": "object",
      "additionalProperties": false,
      "required": [
        "summary_path",
        "raw_output_root",
        "raw_output_root_is_gitignored",
        "max_total_calls",
        "planned_call_count",
        "actual_call_count",
        "budget_exceeded",
        "network_call_attempted",
        "environment_precheck_passed",
        "token_logged",
        "request_url_logged"
      ],
      "properties": {
        "summary_path": {"const": "docs/a_long_000666_sw_membership_supplement_execution_summary_20260604.json"},
        "raw_output_root": {"const": "data/a_long/raw/tushare/000666_sw_membership_supplement_20260604/"},
        "raw_output_root_is_gitignored": {"const": true},
        "max_total_calls": {"const": 4},
        "planned_call_count": {"enum": [3, 4]},
        "actual_call_count": {"type": "integer", "minimum": 0, "maximum": 4},
        "budget_exceeded": {"const": false},
        "network_call_attempted": {"type": "boolean"},
        "environment_precheck_passed": {"type": "boolean"},
        "token_logged": {"const": false},
        "request_url_logged": {"const": false}
      }
    },
    "target": {
      "type": "object",
      "additionalProperties": false,
      "required": ["symbol", "remaining_audit_blocker", "existing_materialized_membership_row_count_for_target"],
      "properties": {
        "symbol": {"const": "000666.SZ"},
        "remaining_audit_blocker": {"const": "missing_sw_membership_for_delisted_sample"},
        "existing_materialized_membership_row_count_for_target": {"const": 0}
      }
    },
    "endpointResult": {
      "type": "object",
      "additionalProperties": false,
      "required": [
        "call_id",
        "component_id",
        "api_family",
        "request_shape_without_token",
        "call_status",
        "row_count",
        "columns",
        "required_fields_present",
        "required_fields_missing",
        "target_symbol",
        "target_match_field",
        "target_match_count",
        "raw_payload_ref",
        "tracked_summary_excludes_raw_rows",
        "error_class",
        "error_message_redacted"
      ],
      "properties": {
        "call_id": {
          "enum": [
            "stock_basic_000666_delisted_context",
            "index_member_000666_ts_code_filter",
            "index_classify_sw_l2_context",
            "index_member_all_000666_ts_code_filter",
            "index_member_all_current_universe_crosscheck"
          ]
        },
        "component_id": {"enum": ["delisted_symbol_context", "sw_classification_context", "sw_membership_candidate"]},
        "api_family": {"enum": ["stock_basic", "index_member", "index_classify", "index_member_all"]},
        "request_shape_without_token": {"type": "object", "additionalProperties": {"type": ["string", "number", "boolean", "null"]}},
        "call_status": {"enum": ["success", "empty", "error"]},
        "row_count": {"type": ["integer", "null"], "minimum": 0},
        "columns": {"type": "array", "items": {"$ref": "#/$defs/nonEmptyString"}},
        "required_fields_present": {"type": "array", "items": {"$ref": "#/$defs/nonEmptyString"}},
        "required_fields_missing": {"type": "array", "items": {"$ref": "#/$defs/nonEmptyString"}},
        "target_symbol": {"const": "000666.SZ"},
        "target_match_field": {"enum": ["ts_code", "con_code", "none"]},
        "target_match_count": {"type": "integer", "minimum": 0},
        "target_value_flags": {
          "type": "object",
          "additionalProperties": false,
          "properties": {
            "industry": {"type": "boolean"},
            "area": {"type": "boolean"}
          }
        },
        "raw_payload_ref": {"$ref": "#/$defs/nonEmptyString"},
        "tracked_summary_excludes_raw_rows": {"const": true},
        "error_class": {"type": ["string", "null"]},
        "error_message_redacted": {"type": ["string", "null"]}
      }
    },
    "decision": {
      "type": "object",
      "additionalProperties": false,
      "required": [
        "supplement_status",
        "candidate_sw_membership_source_found",
        "data_can_be_used_for_alpha_now",
        "audit_rerun_authorized_by_this_summary",
        "signal_search_authorized_by_this_summary",
        "plain_result",
        "next_action"
      ],
      "properties": {
        "supplement_status": {
          "enum": [
            "dry_run_environment_ready",
            "not_executed_environment_missing",
            "candidate_sw_membership_source_found",
            "no_candidate_sw_membership_source_found",
            "partial_or_failed_supplement_probe"
          ]
        },
        "candidate_sw_membership_source_found": {"type": "boolean"},
        "data_can_be_used_for_alpha_now": {"const": false},
        "audit_rerun_authorized_by_this_summary": {"const": false},
        "signal_search_authorized_by_this_summary": {"const": false},
        "plain_result": {"$ref": "#/$defs/nonEmptyString"},
        "next_action": {"$ref": "#/$defs/nonEmptyString"}
      }
    },
    "prohibitedClaims": {
      "type": "object",
      "additionalProperties": false,
      "required": [
        "a_long_data_ready",
        "a_long_alpha_found",
        "sw_membership_gap_closed_by_packet_artifact",
        "signal_search_authorized",
        "audit_rerun_authorized",
        "production_ready",
        "ship_gate_evidence",
        "full_size_allowed",
        "provider_selected",
        "datahub_authorized",
        "broker_or_order_automation_authorized"
      ],
      "properties": {
        "a_long_data_ready": {"const": false},
        "a_long_alpha_found": {"const": false},
        "sw_membership_gap_closed_by_packet_artifact": {"const": false},
        "signal_search_authorized": {"const": false},
        "audit_rerun_authorized": {"const": false},
        "production_ready": {"const": false},
        "ship_gate_evidence": {"const": false},
        "full_size_allowed": {"const": false},
        "provider_selected": {"const": false},
        "datahub_authorized": {"const": false},
        "broker_or_order_automation_authorized": {"const": false}
      }
    }
  }
}
